{
  "schemaVersion": 1,
  "policyVersion": "trajectory-v1",
  "eventId": "64e102e6b1c9081cd363ef20f252e09680844829dee157261ad85d0db557587b",
  "taskId": "task-101",
  "taskRunId": "task-101-run-1",
  "sessionHash": "bbbbbbbbbbbbbbbbbbbbbbbbbbbbbbbbbbbbbbbbbbbbbbbbbbbbbbbbbbbbbbbb",
  "sequence": 1,
  "from": "intake",
  "to": "plan",
  "cause": "plan-observed",
  "sourceHook": "tool-result",
  "taskDigest": "cccccccccccccccccccccccccccccccccccccccccccccccccccccccccccccccc",
  "treeDigest": null,
  "skippedPhases": [],
  "skipReason": null,
  "observedAt": "2026-08-08T00:00:01.000Z",
  "terminalTaskOutcomeRef": null
}
